{
  "$schema": "../schema/service-contract.schema.json",
  "schema_version": 1,
  "id": "nifm",
  "title": "NIFM MITM contract",
  "firmware": [{"version": "20.5.0", "confidence": "confirmed"}],
  "targets": ["nifm:u", "nifm:s"],
  "access_modes": ["passive_mitm"],
  "objects": [
    {"id": "root", "path": "root", "name": "IStaticService", "operations": [{"id": 4, "name": "CreateGeneralServiceOld", "confidence": "confirmed"}, {"id": 5, "name": "CreateGeneralService", "request": {"fields": [{"name": "reserved_pid", "type": "u64"}]}, "confidence": "confirmed"}]},
    {"id": "general", "path": "root.cmd4|root.cmd5", "name": "IGeneralService", "operations": [{"id": 4, "name": "CreateRequest", "request": {"fields": [{"name": "requirement_preset", "type": "u32"}]}, "confidence": "confirmed"}, {"id": 12, "name": "GetCurrentIpAddress", "response": {"fields": [{"name": "ipv4", "type": "ipv4"}]}, "confidence": "confirmed"}, {"id": 15, "name": "GetCurrentIpConfigInfo", "response": {"fields": [{"name": "ip_auto", "type": "bool"}, {"name": "ipv4", "type": "ipv4"}, {"name": "mask", "type": "ipv4"}, {"name": "gateway", "type": "ipv4"}, {"name": "dns_auto", "type": "bool"}, {"name": "dns_preferred", "type": "ipv4"}, {"name": "dns_alternate", "type": "ipv4"}]}, "confidence": "confirmed"}, {"id": 18, "name": "GetInternetConnectionStatus", "response": {"fields": [{"name": "type", "type": "u8"}, {"name": "wifi_strength", "type": "u8"}, {"name": "status", "type": "u8"}]}, "confidence": "confirmed"}]},
    {"id": "request", "path": "root.cmd4|root.cmd5.cmd4", "name": "IRequest", "operations": [{"id": 0, "name": "GetRequestState", "response": {"fields": [{"name": "state", "type": "u32"}]}, "confidence": "confirmed"}, {"id": 1, "name": "GetResult", "confidence": "confirmed"}, {"id": 2, "name": "GetSystemEventReadableHandles", "response": {"handles": [{"name": "events", "type": "handle[]"}]}, "confidence": "confirmed"}, {"id": 4, "name": "Submit", "confidence": "confirmed"}, {"id": 6, "name": "SetRequirementPreset", "request": {"fields": [{"name": "requirement_preset", "type": "u32"}]}, "confidence": "confirmed"}, {"id": 12, "name": "SetPersistent", "request": {"fields": [{"name": "persistent", "type": "bool"}]}, "confidence": "confirmed"}, {"id": 24, "name": "RegisterSocketDescriptor", "request": {"fields": [{"name": "socket_descriptor", "type": "s32"}]}, "confidence": "confirmed"}, {"id": 25, "name": "UnregisterSocketDescriptor", "request": {"fields": [{"name": "socket_descriptor", "type": "s32"}]}, "confidence": "confirmed"}]}
  ],
  "workflows": [
    {"id": "passive-request-observation", "kind": "passive", "purpose": "Observe native connectivity requests without constructing a second request.", "confidence": "confirmed", "sessions": [{"role": "client", "count": 1}], "steps": [{"id": "forward", "session": "client", "action": "Forward root, general-service, and request-object calls unchanged."}, {"id": "correlate", "session": "client", "action": "Correlate request state, result, event handles, and registered socket descriptors."}]},
    {"id": "descriptor-lifecycle-diagnosis", "kind": "diagnostic", "purpose": "Check the state-sensitive registered-socket boundary.", "confidence": "confirmed", "sessions": [{"role": "request", "count": 1}], "steps": [{"id": "state", "session": "request", "action": "Read IRequest state before changing descriptor attachment.", "operation": "request:0 GetRequestState"}, {"id": "register", "session": "request", "action": "Register one socket descriptor only in state 3 when no descriptor is tracked.", "operation": "request:24 RegisterSocketDescriptor"}, {"id": "unregister", "session": "request", "action": "Unregister the tracked descriptor or -1 only while the request remains in state 3.", "operation": "request:25 UnregisterSocketDescriptor"}]}
  ],
  "constraints": ["Passive MITM must not invent request ordering or attach descriptors to a client request.", "Descriptor attachment is lifecycle state rather than routing control.", "A descriptor mismatch or a state other than 3 is a NIFM contract failure, not a reason to reuse the request blindly."],
  "provenance": [{"kind": "implemented_decoder", "reference": "net-probe/src/mitm_trace.cpp"}, {"kind": "static_analysis", "reference": "NIFM IRequest analysis on firmware 20.5.0"}]
}
